<!DOCTYPE GEDCOM SYSTEM "GEDCOMv60.dtd"><?xml-stylesheet type="text/xsl" href="collapsed.xsl"?><GEDCOM><HeaderRec><FileCreation Date="13 February 2004" Time="03:50:51"><Product><ProductId>IGI</ProductId><Version>5.0</Version><Name>International Genealogical Index (R)</Name><Supplier><Link Target="ContactRec" Ref="XSLTCORP122120120120120" /></Supplier></Product><Copyright></Copyright></FileCreation><Submitter><Link Target="ContactRec" Ref="SUB01" /></Submitter></HeaderRec><FamilyRec Id="F306458249"><HusbFath><Link Target="IndividualRec" Ref="I100294220735" /></HusbFath><WifeMoth><Link Target="IndividualRec" Ref="I100294220736" /></WifeMoth><Child><Link Target="IndividualRec" Ref="I100294220729" /><ChildNbr>1</ChildNbr></Child><Child><Link Target="IndividualRec" Ref="I100294220730" /><ChildNbr>2</ChildNbr></Child><Child><Link Target="IndividualRec" Ref="I100294220731" /><ChildNbr>3</ChildNbr></Child><Child><Link Target="IndividualRec" Ref="I100294220732" /><ChildNbr>4</ChildNbr></Child><Child><Link Target="IndividualRec" Ref="I100294220733" /><ChildNbr>5</ChildNbr></Child><Child><Link Target="IndividualRec" Ref="I100294220734" /><ChildNbr>6</ChildNbr></Child><BasedOn><Link Target="EventRec" Ref="XSLTBIRT122123120120" /><Link Target="EventRec" Ref="XSLTBIRT122126120120" /><Link Target="EventRec" Ref="XSLTBIRT122127120120" /><Link Target="EventRec" Ref="XSLTBIRT122128120120" /><Link Target="EventRec" Ref="XSLTBIRT122129120120" /><Link Target="EventRec" Ref="XSLTBIRT122130120120" /></BasedOn></FamilyRec><IndividualRec Id="I100294220729"><IndivName>Bernt Olaf /Skonnord/</IndivName><Gender>M</Gender></IndividualRec><IndividualRec Id="I100294220735"><IndivName>Ole Eriksen /Skonnord/</IndivName><Gender>M</Gender><DeathStatus>dead</DeathStatus></IndividualRec><IndividualRec Id="I100294220736"><IndivName>Nikoline Beate Cristensdatter /Hoff/</IndivName><Gender>F</Gender></IndividualRec><IndividualRec Id="I100294220730"><IndivName>Edvard Olsen /Skonnord/</IndivName><Gender>M</Gender></IndividualRec><IndividualRec Id="I100294220731"><IndivName>Martinus /Skonnord/</IndivName><Gender>M</Gender></IndividualRec><IndividualRec Id="I100294220732"><IndivName>Olaf /Skonnord/</IndivName><Gender>M</Gender><DeathStatus>dead</DeathStatus></IndividualRec><IndividualRec Id="I100294220733"><IndivName>Johannes Olsen /Skonnord/</IndivName><Gender>M</Gender></IndividualRec><IndividualRec Id="I100294220734"><IndivName>Mathia /Skonnord/</IndivName><Gender>F</Gender></IndividualRec><EventRec Id="XSLTBIRT122123120120" Type="birth"><Participant><Link Target="IndividualRec" Ref="I100294220729" /><Role>principle</Role></Participant><Date>14 JUN 1860</Date><Place><PlaceName>Snertingdal, Oppland, Norway</PlaceName></Place></EventRec><EventRec Id="XSLTBIRT122124120120" Type="birth"><Participant><Link Target="IndividualRec" Ref="I100294220735" /><Role>principle</Role></Participant><Date>17 NOV 1817</Date><Place><PlaceName>, , Norway</PlaceName></Place></EventRec><EventRec Id="XSLTDEAT123124120120" Type="death"><Participant><Link Target="IndividualRec" Ref="I100294220735" /><Role>principle</Role></Participant><Date>06 JAN 1900</Date><Place><PlaceName>, , Norway</PlaceName></Place></EventRec><EventRec Id="XSLTBIRT122126120120" Type="birth"><Participant><Link Target="IndividualRec" Ref="I100294220730" /><Role>principle</Role></Participant><Date>       1845</Date><Place><PlaceName>, , Norway</PlaceName></Place></EventRec><EventRec Id="XSLTBIRT122127120120" Type="birth"><Participant><Link Target="IndividualRec" Ref="I100294220731" /><Role>principle</Role></Participant><Date>       1856</Date><Place><PlaceName>Snertingdal, Oppland, Norway</PlaceName></Place></EventRec><EventRec Id="XSLTBIRT122128120120" Type="birth"><Participant><Link Target="IndividualRec" Ref="I100294220732" /><Role>principle</Role></Participant><Place><PlaceName>, , Norway</PlaceName></Place></EventRec><EventRec Id="XSLTDEAT123128120120" Type="death"><Participant><Link Target="IndividualRec" Ref="I100294220732" /><Role>principle</Role></Participant><Date>16 APR 1958</Date><Place><PlaceName>Of, , , Norway</PlaceName></Place></EventRec><EventRec Id="XSLTBIRT122129120120" Type="birth"><Participant><Link Target="IndividualRec" Ref="I100294220733" /><Role>principle</Role></Participant><Date>       1872</Date><Place><PlaceName>, , Norway</PlaceName></Place></EventRec><EventRec Id="XSLTBIRT122130120120" Type="birth"><Participant><Link Target="IndividualRec" Ref="I100294220734" /><Role>principle</Role></Participant><Date>       1864</Date><Place><PlaceName>, , Norway</PlaceName></Place></EventRec><ContactRec Id="XSLTCORP122120120120120" Type="business"><Name>The Church of Jesus Christ of Latter-day Saints</Name><MailAddress><AddrLine>50 East North Temple Street</AddrLine><AddrLine>Salt Lake City, Utah 84150</AddrLine></MailAddress></ContactRec><ContactRec Id="SUB01" Type="person"><Name>Created by FamilySearch (TM) Internet Genealogy Service</Name><MailAddress><AddrLine>50 East North Temple Street</AddrLine><AddrLine>Salt Lake City, Utah 84150</AddrLine></MailAddress></ContactRec><SourceRec Id="S01"><Repository><Link Target="RepositoryRec" Ref="R01" /></Repository><Title>International Genealogical Index (R)</Title><Author>The Church of Jesus Christ of Latter-day Saints</Author><Publishing>The Church of Jesus Christ of Latter-day Saints</Publishing></SourceRec><RepositoryRec Id="R01"><Name>Family History Library</Name><MailAddress><AddrLine>35 N West Temple Street</AddrLine><AddrLine>Salt Lake City, Utah 84150  USA</AddrLine></MailAddress></RepositoryRec></GEDCOM>